page;para_num;text;pdf_name;question;answer;text_synthetic
4;4;The second subsection (Gender Differences in Subjective Assessments) goes into more detail about self-assessments, assessments by others, and personality-style assessments. The third subsection (Gender Differences in Creative Achievement) considers differences in creative accomplishment. This subsection does not document differences in achievement across a wide variety of domains. The existence of such differences is widely recognized, but far more research effort has gone into trying to understand the causes of such differences (as described below in the Theories of Gender Differences in Creativity section of this paper) than has gone into trying to document them. The evidence of differences in creative achievement reviewed in this subsection includes just one study of what might be thought of as long-term real-world achievement. (That study is, in fact, an investigation of publication success in the field of creativity research.) The rest of the subsection reviews gender differences in studies of the creativity of actual products (e.g., poems, stories, collages) created by subjects in psychological experiments.;Journal of Creative Behavior - 2011 - BAER - Gender Differences in Creativity;"What does the third subsection of the paper, ""Gender Differences in Creative Achievement,"" focus on and what type of studies does it review?";"The third subsection, ""Gender Differences in Creative Achievement,"" focuses on the differences in creative accomplishments between genders. It reviews studies related to the creativity of actual products like poems, stories, collages created by subjects in psychological experiments. It also includes a study on long-term real-world achievement, specifically publication success in the field of creativity research. However, it does not document differences in achievement across a wide variety of domains.";"Text: The second subsection (Gender Differences in Subjective Assessments) goes into more detail about self-assessments, assessments by others, and personality-style assessments. The third subsection (Gender Differences in Creative Achievement) considers differences in creative accomplishment. This subsection does not document differences in achievement across a wide variety of domains. The existence of such differences is widely recognized, but far more research effort has gone into trying to understand the causes of such differences (as described below in the Theories of Gender Differences in Creativity section of this paper) than has gone into trying to document them. The evidence of differences in creative achievement reviewed in this subsection includes just one study of what might be thought of as long-term real-world achievement. (That study is, in fact, an investigation of publication success in the field of creativity research.) The rest of the subsection reviews gender differences in studies of the creativity of actual products (e.g., poems, stories, collages) created by subjects in psychological experiments.
Human: What does the third subsection of the paper, ""Gender Differences in Creative Achievement,"" focus on and what type of studies does it review?
Assistant: The third subsection, ""Gender Differences in Creative Achievement,"" focuses on the differences in creative accomplishments between genders. It reviews studies related to the creativity of actual products like poems, stories, collages created by subjects in psychological experiments. It also includes a study on long-term real-world achievement, specifically publication success in the field of creativity research. However, it does not document differences in achievement across a wide variety of domains.

"
4;6;"Divergent thinking tests have dominated creativity testing, and the various Torrance Tests (Torrance, 1966a, 1966b, 1966c, 1970, 1981, 1988, 1990a, 1990b; Torrance, Khatena, & Cunnington, 1973) have dominated the field of divergent thinking testing. Perhaps most popular are the Torrance Tests for Creative Thinking (TTCT; Torrance, 1966c, 1970, 1974, 1990a, 1990b). According to one view of creativity research (Torrance & Presbury, 1984), three-quarters of all published studies used one of the Torrance Tests, and one meta-analytic evaluation of the effects of various creativity training programs (Rose & Lin, 1984) judged the Torrance Tests to be so pervasive that it included only studies which had employed these tests. Add to these studies those that have used one of the Wallach and Kogan (1965) divergent thinking tests and it is easy to see that divergent thinking tests have been ubiquitous as measures of creativity.";Journal of Creative Behavior - 2011 - BAER - Gender Differences in Creativity;What is the significance of the Torrance Tests in the field of divergent thinking and creativity research?;The Torrance Tests have significant importance in the field of divergent thinking and creativity research. They have dominated the field of divergent thinking testing and are perhaps the most popular tests for creative thinking. According to one view, three-quarters of all published studies in creativity research have used one of the Torrance Tests. Furthermore, one meta-analytic evaluation of the effects of various creativity training programs judged the Torrance Tests to be so pervasive that it included only studies which had employed these tests.;"Text: Divergent thinking tests have dominated creativity testing, and the various Torrance Tests (Torrance, 1966a, 1966b, 1966c, 1970, 1981, 1988, 1990a, 1990b; Torrance, Khatena, & Cunnington, 1973) have dominated the field of divergent thinking testing. Perhaps most popular are the Torrance Tests for Creative Thinking (TTCT; Torrance, 1966c, 1970, 1974, 1990a, 1990b). According to one view of creativity research (Torrance & Presbury, 1984), three-quarters of all published studies used one of the Torrance Tests, and one meta-analytic evaluation of the effects of various creativity training programs (Rose & Lin, 1984) judged the Torrance Tests to be so pervasive that it included only studies which had employed these tests. Add to these studies those that have used one of the Wallach and Kogan (1965) divergent thinking tests and it is easy to see that divergent thinking tests have been ubiquitous as measures of creativity.
Human: What is the significance of the Torrance Tests in the field of divergent thinking and creativity research?
Assistant: The Torrance Tests have significant importance in the field of divergent thinking and creativity research. They have dominated the field of divergent thinking testing and are perhaps the most popular tests for creative thinking. According to one view, three-quarters of all published studies in creativity research have used one of the Torrance Tests. Furthermore, one meta-analytic evaluation of the effects of various creativity training programs judged the Torrance Tests to be so pervasive that it included only studies which had employed these tests."
2;7;"Effectiveness may take the form of value. This label is quite clear in the economic research on creativity; it describes how original and valuable products and ideas depend on the current market, and more speciﬁcally on the costs and beneﬁts of contrarianism (i.e., originality; Rubenson, 1991; Rubenson & Runco, 1992, 1995; Sternberg & Lubart, 1991). Value was also recognized by Bethune—in 1839! He described value as: The stability of the fabric which gives perpetuity to the decoration. To mingle the useful with the beautiful, is Correspondence should be sent to Mark A. Runco, Torrance Creativity Center, University of Georgia, Aderhold Hall, Athens, GA 30602. E-mail: runco@uga.edu CREATIVITY RESEARCH JOURNAL, 24(1), 92–96, 2012 Copyright#Taylor & Francis Group, LLC ISSN: 1040-0419 print=1532-6934 online DOI: 10.1080/10400419.2012.650092";The Standard Definition of Creativity;What is the relationship between originality, value, and the market according to economic research on creativity?;According to economic research on creativity, the relationship between originality, value, and the market is that original and valuable products and ideas depend on the current market. More specifically, their value is determined by the costs and benefits of contrarianism, or originality.;"Text: Effectiveness may take the form of value. This label is quite clear in the economic research on creativity; it describes how original and valuable products and ideas depend on the current market, and more speciﬁcally on the costs and beneﬁts of contrarianism (i.e., originality; Rubenson, 1991; Rubenson & Runco, 1992, 1995; Sternberg & Lubart, 1991). Value was also recognized by Bethune—in 1839! He described value as: The stability of the fabric which gives perpetuity to the decoration. To mingle the useful with the beautiful, is Correspondence should be sent to Mark A. Runco, Torrance Creativity Center, University of Georgia, Aderhold Hall, Athens, GA 30602. E-mail: runco@uga.edu CREATIVITY RESEARCH JOURNAL, 24(1), 92–96, 2012 Copyright#Taylor & Francis Group, LLC ISSN: 1040-0419 print=1532-6934 online DOI: 10.1080/10400419.2012.650092
Human: What is the relationship between originality, value, and the market according to economic research on creativity?
Assistant: According to economic research on creativity, the relationship between originality, value, and the market is that original and valuable products and ideas depend on the current market. More specifically, their value is determined by the costs and benefits of contrarianism, or originality."
3;1;The highest style of art. The one adds grace, the other value. It would be a poor summing up of a life upon earth, to find that all the powers of an immortal intellect had been devoted to the amusement of idle hours, or the excitement of empty mirth, or even the mere gratification of taste, without a single effort to make men wiser and better and happier. If the examination be made, it will be found, that those works of Genius are the most appreciated, which are the most pregnant with truth, which give us the best illustrations of nature, the best pictures of the human heart, the best maxims of life, in a word, which are the most useful. (p. 61) Bethune referred to art, and genius, but he assumed that creativity played a role in each.;The Standard Definition of Creativity;What does Bethune believe are the most appreciated works of Genius in art?;Bethune believes that the most appreciated works of Genius in art are those that are most pregnant with truth, provide the best illustrations of nature, the best pictures of the human heart, the best maxims of life, and in a word, those that are the most useful.;"Text: The highest style of art. The one adds grace, the other value. It would be a poor summing up of a life upon earth, to find that all the powers of an immortal intellect had been devoted to the amusement of idle hours, or the excitement of empty mirth, or even the mere gratification of taste, without a single effort to make men wiser and better and happier. If the examination be made, it will be found, that those works of Genius are the most appreciated, which are the most pregnant with truth, which give us the best illustrations of nature, the best pictures of the human heart, the best maxims of life, in a word, which are the most useful. (p. 61) Bethune referred to art, and genius, but he assumed that creativity played a role in each.
Human: What does Bethune believe are the most appreciated works of Genius in art?
Assistant: Bethune believes that the most appreciated works of Genius in art are those that are most pregnant with truth, provide the best illustrations of nature, the best pictures of the human heart, the best maxims of life, and in a word, those that are the most useful."
3;2;Continuing, Yet familiar as the effects of Genius are, it is not easy to define what Genius is. The etymology of the term will, however, assist us. It is derived from the verb, signifying to engender or create, because it has the quality of originating new combinations of thought, and of presenting them with great clearness and force. Originality of conception, and energy of expression, are essential to Genius. (p. 59) It was common to conflate creativity and genius in Bethune’s (1839) era, and, in fact, that same blend can be seen well into the 1900s.;The Standard Definition of Creativity;What are the essential qualities of Genius as defined in Bethune's era?;The essential qualities of Genius as defined in Bethune's era are originality of conception and energy of expression.;"Text: Continuing, Yet familiar as the effects of Genius are, it is not easy to define what Genius is. The etymology of the term will, however, assist us. It is derived from the verb, signifying to engender or create, because it has the quality of originating new combinations of thought, and of presenting them with great clearness and force. Originality of conception, and energy of expression, are essential to Genius. (p. 59) It was common to conflate creativity and genius in Bethune’s (1839) era, and, in fact, that same blend can be seen well into the 1900s.
Human: What are the essential qualities of Genius as defined in Bethune's era?
Assistant: The essential qualities of Genius as defined in Bethune's era are originality of conception and energy of expression."